Aleph Zero Mainnet-validators.csv
Validator,Self-Bonded(AZERO),Total Bonded(AZERO),Nominators,Commission,Grandpa Vote,Reward Point,Latest Mining
5DBhSX89qijHkzUt9gcqsq9RiXxDfbjxyma1z78JSCdt4SoU,"84,850.88697797052","15,651,893.26039614392",793,5.00%,0,24228365,91004089
5Hpz4LwMpRUh1RjMMUDcsJUDSJNzddmQwEMUrwFdKLJzCPiD,"122,863.28407662912","14,150,037.2958887357",131,5.00%,0,21903560,91004099
5Fgato4wJxwZicavjaKQ9oG5e2M1S5wUfy7mMxsw1HTw95ub,"57,747.80708463806","11,309,457.49137862116",8,5.00%,0,17506475,91002560
5EEp31xy9j34ddaXRzWQDP6nyydz4hJiVHSpadvYn5BpeZR7,"700,979.5513457866","10,922,932.2158155975",12,5.00%,0,16908150,91001681
5EvQaBZpAkKZ3ad3ZJh6kUugCyX4TRmUYBsuQs9avbHaEQpf,"51,184.074485894","10,113,970.40530260662",6,5.00%,0,15655920,91003475
5CAfDYiu7fArHfXgM79zsC4BbnWPCpztnmGowC7rLkEEtmzc,"25,000","10,025,000",1,5.00%,0,15518195,91003479
5DtnzFxXHDMya1oviGdWw7R9x5zvJVRkDKiqV2KqBnd9zJDQ,"25,200","9,953,215.60987017338",240,5.00%,0,15407070,91000768
5GgfhVKcdSDdV4e3dRSBzxkzZRm1nmsLNGBeb9bPcKJN6kL7,"25,000","9,025,000",1,5.00%,0,13970250,91004108
5FTsYv3dgJsjndE3ktF1Rp3rF6UjGybGW2mcYVuaFzfrC4Cv,"25,000","8,858,899.42369482466",305,5.00%,0,13713140,91001657
5E1aQhyfWTL7UzZ9yMDTsDQTGQuCUgrukGkTHmjhBHDqz7d5,"25,000.0389154113","7,429,261.40590311438",311,5.00%,0,11500125,91002580
5CJYS1TcUoDtNoc1zRzJZRpRQMn3pGcpscMUs1xfNAWcqDD1,"25,000","6,747,119.93167972254",87,5.00%,0,10444210,91002600
5DM1phZn4jwSVhTG6znYTkCEhz3tqPFHr34jSkB57MXv83iz,"25,930.06967257982","5,955,800.8638983956",237,5.00%,0,9219280,91001674
5Gp4tsfDm3GTsDKaGUCY5EsmduNN3ECLs7dTVHsFmu2pmFkR,"2,145,128.97263127348","4,354,257.53384437388",11,6.00%,0,6740160,91004082
5EhtrQ5GwGnqknzEAAgWA8TGm5NzSr47ox9GEgCXHDqyixdJ,"42,162.7245211721","4,343,086.56481432024",187,5.00%,0,6722870,91002567
5DRbk3BimLzBzQtzUYUP35c57iwXtpqyjbnfY6AX48vbGMQC,"26,000","3,556,565.69439968826",225,12.50%,0,5505395,91004079
5FqcFJEQrUyBBpzsaN8wxPMJVG7fRvZGVhsrRLVT8k1gUqGH,"26,024.6522357675","3,313,046.49554729674",30,5.00%,0,5128445,91004114
5EjX1sVKuvrDAkm3XVS1xBLfboH5GqfLG9WnBwe8Pki8qwR6,"25,000","3,283,848.22836506934",333,12.50%,0,5083225,91004122
5H8VGiMbD2QBV4qCyjmwK5e1J3LQb956yunaULeH2qRkrypt,"25,005.81962290258","3,229,287.1942704372",57,5.00%,0,4998770,91003484
5F4P6AGQPwVUX3mwfmc64fnGd1abEV2QDKdVT3KRRw793WYK,"26,000","3,159,907.6540845221",267,12.50%,0,4891390,91004118
5GsqnQjwhayJ1TEtv43ZYQvvvMkG2pEgucGJw39ci96R1pVp,"26,000","3,129,124.74072472432",295,12.50%,0,4843720,91004084
5HdUiPkneLL2dQHvFkp47cfw63uPWSL8gFPzduLw6YXx3cBU,"25,322.34571183978","3,122,902.36611508946",308,12.50%,0,4834095,91004100
5H9h84SrX4gdXTxGyB6wtEfTye5Kb7vMcwARNLCZxMa1CruS,"26,000","3,102,363.0385692264",326,12.50%,0,4802315,91004085
5FhatJywcEvZEqj2s7sC5HyQapWuJPEDEJpnjSwRS7DgFjfP,"25,034.0088781141","2,952,215.49374712084",11,5.00%,0,4569880,91002573
5F3xe3GkA9fDtVn7z6oK9PZ38nVvgvQme9uAyKBJbdmthqNd,"69,556.36337145112","2,757,342.11399571442",46,5.00%,0,4268215,91001687
5GFCZjWGSHas86192H3yiZZFySLtUW74SdHDqTymBEDUUF7T,"26,000","2,347,843.79420591038",350,12.50%,0,3634330,91004111
5CcZnvQmvNJviAxpnmZKVM9aYtfoyRsE4YKoTig9jWBTW8zH,"26,000","2,307,090.72600171302",265,12.50%,0,3571260,91004104
5CLKaVt884KiY5w8aXwHg7X6Xr6pF6B4GmStNdKSYWojd9N4,"25,000.010001","2,168,165.04048683428",122,5.00%,0,3356220,91001661
5HosKV5vxt3Hf5kMrfnG5MokMi4dCSLUyw3fG3WTUETeCu7V,"25,998.73148935786","1,983,458.54702903614",105,5.00%,0,3070305,91003494
5CkxdKNvW2VFzBs8Gaz1Yb4iUhiyvetaT6N5Etmo2NoxoC72,"808,355.9029626837","1,850,847.21729634432",7,5.00%,0,2865030,91001670
5FboCt65vq5on8GBFnHpMy4oWtCsukFPCK8fbHL4gbsyny5t,"25,014.74085803152","1,763,271.91901317394",15,5.00%,0,2729440,91004102
5CFLCu3i6Gi2dc4hnwftWMKEeNsQErV6cQyeA9MZer8FCaqL,"1,476,202.03808695268","1,726,971.75279441362",6,5.00%,0,2673265,91000771
5Dvir8ATZpJutJ3q3sSrCJ4r4KHXF2pHw63WFWuXtESiExXu,"37,258.46637069578","1,676,001.12412719136",46,5.00%,0,2594375,91002599
5GeHFfVJYjrDNnSTRWP4EZo5169hkXLecJUNoMGLY6XpEuo6,"807,583.81943204532","1,604,719.08660150462",4,5.00%,0,2484020,91002585
5CSAaTSr9K3Rx8tNR5aPLh6TP9GgmS152WCfyJHwX3kq6b7a,"807,291.9903437804","1,603,390.32244493376",2,5.00%,0,2481955,91001663
5Gmnx9rj9i9vViVSbX6kRNc7DQ6N1UQYETjCVFpmj8sjTFGt,"793,170.08078012306","1,592,235.38247150754",3,5.00%,0,2464700,91004088
5DyBS9yY985ufDe1x5xmetjS5hzd3d2DrnLYMXNoqFrxcgxn,"110,928.0868736832","1,573,527.63222951328",38,5.00%,0,2435755,91004083
5GZ9BLsAjgQ32FWBGWhuaNFQigXuGiYhJ8LML888r5qTxLpd,"1,421,076.06836997886","1,571,307.42243608754",4,5.00%,0,2432290,91001682
5D5ULUW4YgE94oAGeNat6pB43Dzi2GabT1dbD6srA4iBS5dY,"41,623.77299070472","1,556,469.65459705732",1,5.00%,0,2409330,91002565
5CK2GZvpmKYxJQXMQzHa2vvHLf5cibuWK4qkcCem2p9PXYx1,"26,000","1,531,948.1532289922",321,12.50%,0,2371390,91004101
5DfkYqdsHboM1PQceB756MQxdmXbBUYLWUh6jYzmi5hgGFax,"1,178,285.8512975196","1,531,484.42233898448",12,5.00%,0,2370655,91001688
5F7LMmcnaZVUb3sWcTqqF56Qhhiku6BB8wumb9TpqaxUUrrR,"1,510,242.94930850226","1,510,242.94930850226",0,9.00%,0,2337790,91003500
5CoxXHzXRZrnVkmdDhYVHz5b6PJdCRmR5yGSQmQwzasHyzaw,"26,000","1,502,651.96447902564",246,12.50%,0,2326030,91004087
5HbkHKhATyADeZrGCqsdrrynnw5ZD6XkcNLFB5su6ryNvQJ2,"31,616.0597183306","1,429,057.22661336728",65,5.00%,0,2212105,91003486
5CJJqLZxKW8HLoma3ogfmzvzHpSVN3fqJ8n4QqTzA7f9TVry,"1,281,830.35080190646","1,396,981.23987265204",5,5.00%,0,2162475,91004124
5H8WX3cQKhFHHWCyfxUEMao9dTJNkE4Vamsx2GXWBaPTvfix,"1,343,086.43072399026","1,395,118.35351431836",5,5.00%,0,2159570,91002578
5GNZhKZ55782WNy7xRgdMBVwDc33qgUzZs6wyNazUJDwtwdD,"57,000.01277653282","1,382,608.59659222652",66,5.00%,0,2140215,91004105
5G9C4R35Din2ZzY6y1taJSC65Ete9JQS6TCbrr3HzTyW9Nc6,"1,358,640.35066712936","1,365,754.20558696094",2,5.00%,0,2114105,91002577
5EC7gyGjycb4bKWGTVFYu3yWyxS586FbsVPaLNRAH8Bt1Yxp,"1,332,588.3081994515","1,345,017.73171929068",1,7.00%,0,2082010,91001655
5GhAbdgaGaNobd927sgaxEBLKNj41bsE9mfPtjWEfHDtdzUj,"1,312,630.5723922552","1,330,079.73049453118",3,5.00%,0,2058910,91003454
5FA7cBE3cF7B3tpjKntk7wrTDUVE7RqipUCRNuGJdeR1tx75,"1,327,263.16336758992","1,327,263.16336758992",0,5.00%,0,2054535,91001700
5CfDUiJRnvijd948BAJU3aegw9U5hCJRQU6JAcTNK5yj4uKp,"72,019.15165619782","1,315,044.6295638802",5,5.00%,0,2035635,91004123
5FgxkphBGvm5ju8gaLFJUjkrEU91Kos99E5Fow6xwDi9466p,"1,300,000","1,308,486.08681828086",3,5.00%,0,2025485,91002592
5GZ28wCfo1cbStUM6BZPKMihKswmLvNwLQi5nKJacFjfxfP8,"30,478.98763136122","1,185,891.90544938396",10,5.00%,0,1835715,91000789
5G3zom77dYvquCJEy92ca59hcS5bDVFsLWkk2PVYj2sister,"42,000.07528998832","1,164,831.4647474288",68,5.00%,0,1803095,91001699
5HTqxQJjEnAzunBpr6mXzRAjnSCPrNUyqvwNzLJx9ty7Eq1g,"1,149,642.51285944412","1,158,833.93215449754",3,5.00%,0,1793820,91001689
5DoSWKmubRKpk1sNWJjSreKkW5fWPyVDFEAkL2E18Z3UZMbr,"25,000.17732612516","1,156,438.10037018304",21,5.00%,0,1790110,91000788
5Ggatomsdkh6ByjPUfrHvEhdGpGNFh8rai1cdzokJz3KvgD1,"44,583.77195132102","1,134,810.80515337346",8,5.00%,0,1756615,91002590
5Df8FnXGBa4euYHfMyPRK2CJwHmWCwpWVKqu99N7XqKj8wB1,"115,276.06135317368","1,092,019.28739361958",4,5.00%,0,1690395,91003471
5ECLtXxohTfu9E63MMEXpzVkALmCGbGt79WVdtDhMqiLARJT,"25,102.12173297654","1,077,718.38211991012",36,5.00%,0,1668240,91000776
5GpiJXpQ1jhSEFh4UdV8foTqMBEPV3HKE2fG4ijHj2N6easc,"30,125.7671048714","1,054,804.56017182362",1,5.00%,0,1632785,91000785
5CSkE9o7krWKFLoBUvhMqjLEnJSt7iCUHwG9sBbjkAPisHu3,"29,766.83667705234","960,165.428169146",1,5.00%,0,1486275,91004075
5CeaCAGqv3nbenDbgqYqyeKbSAnxDLdgSqALjAy81iKfQyfh,"914,815.58321969534","914,815.58321969534",0,5.00%,0,1416100,91004112
5CZtrSYaexzBntHFgCdsmnJpeyZy4eNJighL6vXLffEzCVvc,"40,432.7441087053","900,718.40402737636",6,5.00%,0,1394260,91002579
5GLVPAGaov8YZQq1fgrRyuMNyLTXNi1ggFQMV2ti2NfkQJby,"891,244.79075263838","900,634.14925270894",3,5.00%,0,1394120,91002596
5FEa13CrKDadmB8Dgr8UYnRExTe4ZQxt34w4EcnAWwycGnEg,"40,077.73118071562","879,930.69848042166",97,5.00%,0,1362095,91004095
5Ggeo3mbNaiZZVE1RJaSKB4kD9qeqy78hRiFE6tWUbazCbPS,"200,000","870,202.20031701448",53,5.00%,0,1347045,91001684
5Dy79kYuTLexQdfoFAkJALmAtiADHPtAhfqU29vvFU5BxGC7,"49,201.65851390696","841,404.6752679481",9,10.00%,0,1302455,91001680
5DRQgiDW1kpf6x8raZWJFamHQ1UHcWQQATkz1NLLAp1m2Rvo,"136,912.06831520628","807,743.15604762238",24,5.00%,0,1250340,91000779
5ExvHHbkKfvpZ1BkaYvN7ko63iFgYsDxUfFxcUZqgeDz8yNQ,"38,520.78860104486","807,065.5802614977",17,5.00%,0,1249290,91004117
5Hb9fWRL3gwgoPj9D5oEaFAs7E5muURMNLSrHEpo9dsLnC1e,"25,000","791,934.45190898018",18,5.00%,0,1225875,91002595
5Ft764w9aA8dMTBM6hC2tFGHeECWQrjxsHxDE93hP1KcH1PS,"32,091.91942603176","740,574.6165390596",23,5.00%,0,1146390,91003470
5Fboy1HM9gBCqEjSF3pPphywg2GfSLQ1qXLdhd5156tQA9u3,"228,022.30178008176","733,963.29112809378",17,5.00%,0,1136135,91001693
5Ek8xfKHf9uyBx1BhZyoESxD3NGRsowTchVhNH4kFk2V4U9E,"25,005","729,891.96930451052",10,5.00%,0,1129835,91001683
5EkWPqhUrqQjV4CBNwhXBdCRRsf2ZJVjCosVeEpdQh6HNWof,"38,677.4927941549","675,494.60918261758",17,5.00%,0,1045625,91001695
5F284z8dnXiFTQhk2c6eMtCP1hfGkfRciYFpQfj4TfMZyk2f,"25,042.1421551562","583,978.71496191754",31,5.00%,0,903980,91003499
5E7QcwMZUahGd9YVQZJXriTVfuD1wS3MRPcLCNyvkoHmPgrX,"32,387.22659241636","553,650.53445060038",16,5.00%,0,857010,91000796
5GWiDQmeZdv2gAbuvS59btiJeukZsMgNB5h4g4UNyQj8rDYB,"40,802.54183491186","469,134.88580723152",18,5.00%,0,726180,91003465
5DD8XggGRHJLbK1NB8f76Gz5YWkKsY7H6GFjHsz2BooogChK,"54,143.14943747538","415,133.65138504336",12,5.00%,0,642600,91001669
5EUKn2h53E7WZPXtYSQLU9VFy4tCqF3y7yPLD3heGEvxRXcd,"29,381.91302525778","376,731.23782189764",37,5.00%,0,583170,91003452
5E4MupVUUiEs78nK6w7ucj8Kqw1hT83iuZPioE9xZkxXSk9m,"200,000","334,765.55497387342",10,5.00%,0,518210,91003473
5EyDRLV7tjkK6bx7LETkpBc6fnwgF2zXYEVLrqMLqMNimEeT,"25,001","330,142.96416947866",10,5.00%,0,511035,91000773
5FLFzJyXxhcXXJ1qkgcyrzSMrxB4SahM41wMHpkGhQTXSKh9,"49,690","316,474.45924584198",32,5.00%,0,489895,91003466
5DfjC131Dx2KYc81B7fMBC4s1ZMkuTnngkWKzsbkqKi1denx,"25,448.9999999995","239,828.30111447948",46,5.00%,0,371245,91003460
5G1jesK59FpsD8sTNQ7QtVC8oXd2DztYT7VdWY11jTnbBWwq,"42,610.13249873494","229,704.87393221582",13,5.00%,0,355565,91001658
5E6Anv9pGdq8q33859y7yYdGcKdi9oiq9eDhSy8p4Sbud7C6,"55,000.00285265974","229,380.89916087458",7,5.00%,0,355075,91004115
5EyEWfrR2u5sWE6Yzch8dtVovzVGEwiBAb4rQr3H58K13Pft,"25,877.60672616408","220,514.22657412328",12,5.00%,0,341355,91004107
5GxJj4VrNGZnRmQgedjSP1PUeDmF3yXvKdXNTjBaP7W6Z5wU,"66,521.79666803692","219,025.25749904512",3,5.00%,0,339045,91000470
5GP8WYbvZPrrXkoaXSKRa5NgDkH2wYaG8qKUXqQAHht8Dmft,"201,565.365789947","205,732.365789947",2,5.00%,0,318465,91004120
5GyDQJytZ3U3K85hU1agJ1WpoVX47FJJvfGETPAtdCSb1CLC,"73,581.28955320546","203,404.4665553458",11,5.00%,0,314860,91001659
5E6tsZXDZm4omCaR9bjrvbWrgBrNvGtdzGSbuFgBcvqz7PBN,"25,000","202,154.09429384686",10,5.00%,0,312935,91000762
5G1cwdkxXct9ZbF7JAeBVWMXzmRzEHL45tzs47Ws7cxnSRk5,"138,674.81561681532","171,654.38928947146",3,5.00%,0,265720,91003487
5CiFjvz8thYqiNFi236aCSp7wstmkA6ks6sHMbmcKjYVQzsc,"45,589.87987727046","151,484.34586037988",31,5.00%,0,234500,91002584
5GULs96K2Z3xgumyd8Wp8gGaQBsky1rYJ92yABz3ddupnS3q,"37,111.52661960698","142,817.0737380546",10,5.00%,0,221060,91003467
5ELjha8eeVEg8JCbztkFYFmNC2nYHLUPfC5GBquYPC1LTfK2,"25,001","137,533.51124651198",6,5.00%,0,212905,91004121
5Dvz8NAPs2L3YBGTRfn1uyJxXFiGgXLbPU7LBp7TQr7iMEQf,"25,441.8472669564","129,458.12589873736",4,5.00%,0,200410,91003496
5HGJF4FoTx1MK2JKUSBSEWVoz2uhzyWHjk4Ye3DTZPeK96fX,"25,040.73084076602","125,785.6145137557",6,5.00%,0,194705,91003478
5HWQxs6cpDTur1qTVcEGjHFbqY3qLN11vyVEbpLJJUmbcgPg,"34,446.6505752108","125,324.65446145234",15,5.00%,0,194005,91003464
5EFD4z93FCt8Vv9YRJRvf1Sy4N3FTeMSdCQEJ8y5f6cxB5Pw,"25,002","111,608.81816853112",6,5.00%,0,172760,91002576
5FBka2pNcvjWVatUnpVySSveF8onJAyva1g17zAvqcyqfsum,"26,542.19104015042","111,380.16719492558",20,5.00%,0,172410,91003457
5FiDhGe22aj5LoEQgXLMtg1TneKeikysf72HDKkcAS6xnNMH,"25,000","107,344.89021531074",6,5.00%,0,166180,91002591
5DEu6VG3WkJ1rdPadU4SffSse4sodA5PUE4apnw74c451Lak,"25,000.00001","99,157.01812612824",12,5.00%,0,153475,91002556
5FpSBDijZV7yVBdyMRNAGnYuejaoXqypHr5mtonWcjonCJHi,"30,684.66736529096","96,991.12031684156",4,5.00%,0,150150,91000760
5H6XY6h4ACuRdkqsxApaLkoVNZJiAQUAggD5PuVNKkwGNJbg,"25,009.48426264208","96,821.05609499006",11,5.00%,0,149870,91004093
5EtXMQFPWu3UswKnDtGrSwv63ZFGzc5z7YjAMJaoi7jzKHDB,"32,424.77645287162","91,050.13199530586",8,5.00%,0,140945,91002570
5DfCBWqovj9jrpfTSs9qGmPZAg5ZC48MJUFeq4JPzmzonfFa,"49,188.12176768896","80,350.38591119912",5,5.00%,0,124390,91000795
5EbbxSnnXA5GE8fKUZhpzkn7pi2SkiscAJX7pk7fAS5NF68M,"31,170.54373580924","71,297.79060376064",5,5.00%,0,110355,91002597
5F73AtLJPKJfyyenPLjfx4PqHbw4s6yCfysMFfkXfsWv15nm,"25,041.7474734823","69,776.73669772734",3,5.00%,0,108010,91004092
5G4eZ9sLq8dT9mw7e6Z2HSU24JbYa4Zx5VSEkdpXDom3mQNi,"65,318.579188494","65,318.579188494",0,5.00%,0,101115,91001673
5F9nb9HSF5w5D5qfAaN2zqsHTQFBTXQ3CZJwarY3dBvMA3Zo,"31,765.19230641212","60,728.54369193416",5,5.00%,0,94010,91002562
5CfUzQNGwydem2RBfu1DGQ3KvbZNHEaxbMfYyoWv4NHQa8Rs,"25,000","53,412.62538825606",2,5.00%,0,82670,91003453
5HT68JHy3M8rJU6ovBBg3KUvqWvUfSffJxKSa8n4ssoJmTsN,"30,468.84000175648","48,929.69444086064",4,5.00%,0,75740,91000794
5DfdrtoTXw8hRwe81QrZyPJiEqjB2W4nhE7hsezMQvNZvqqp,"26,376","43,348.6220058379",5,5.00%,0,67095,91004119
5DPcDj9gtW51M6JnZTdDGApXN7os1DdeLZEBe984abKKzCXF,"25,091.9999999995","43,115.00136507318",3,5.00%,0,66745,91004103
5CQKzKrjb6SpLeP3goUYH7E9dHbb66LsBtF8sNAPmaRjf2gF,"25,573.7527712091","41,692.38333703004",2,5.00%,0,64540,91003489
5Gxd4GGJLf4yvKfGwgsCUwDYQUuJskMhZ8fdz7sNBV9ssFUa,"25,000","41,305.2485592809",1,5.00%,0,63945,91001653
5FTuNxTmx8iFrA9mb4ES9hpkvtULju16o9HPjzG4QWuTzW1H,"32,897.86076615906","40,771.61339312902",2,5.00%,0,63105,91004081
5DtQWZdHgtsW9i7MnPJ3qpmmrQu2umfVPATVqFxyyKb5y1Bb,"25,001.73197192512","39,713.0376654216",3,5.00%,0,61460,91003495
5CzQieKZF9SNqq8ETKt5ne1C6p84HNaBDQKo2PndAprT5nFw,"25,000","37,918.68228936386",2,5.00%,0,58695,91003458
5CPJtDEP3CNexY4TrQZ4qFGpUAopEdvs3akjjiyYmW6JRPNC,"25,034.9979532023","36,769.00623913972",1,5.00%,0,56910,91004090
5CVWRBm7RtWR9pfk1K3z4WSJPpK5yNUJ9FmkXWCGW9qrjhsA,"25,072.9999999995","35,001.78955228064",3,5.00%,0,54180,91001656
5CShTyMCX3bGzFNMjtZLo4nmsFCDVKoUV13PCUhnb39pxLa8,"34,854.3213607598","34,854.3213607598",0,5.00%,0,53935,91002588
5FgwXv7Kjv6TYGKgfwCfHL3opwTkAPjWsFRcfwDwqeegAywL,"25,000","33,461.42313567834",2,5.00%,0,51800,91003490
5FNmqkNigvEvWeWcjLV3yYL3wjF7H4YxPjt8YJQq9SkRz6DZ,"25,000","33,100.23704699228",2,5.00%,0,51240,91004086
5CAXBpWWrmaaQXn9CjThsL92itUfDRYDhDBM3HkkY4H9UC7V,"25,535.9999999995","33,055.48647992208",3,5.00%,0,51170,91001698
5DAeLpCn8Jwbz9dJGwt5pYgxovTmX3VALySUD2iJ55G5u2iY,"26,428.90404902148","31,563.58259346868",2,5.00%,0,48860,91000791
5DFcfLmaYmKCztB7e8cf6hRkPedc9JXgHkjD7LQFm8CRFNqX,"25,034.9979532023","30,927.29613495626",1,5.00%,0,47880,91003498
5H8bmvZPeJMxqu2c8hfa1cN3i29RvqKca9giGn2nmD92L3Rn,"25,099.9979532023","30,587.23490012894",1,5.00%,0,47355,91004109
5CiUqH44exTaZpEouaPafKR7cL9dAU4sGHqeg9eMa6SKFFGL,"25,000","30,478.28264946854",1,5.00%,0,47180,91001696
5HJw7zFnX3VmxU7tfKgeMjKZhcA5uJdpfxqU2i12iCiddjiV,"25,000","30,124.5165517728",2,5.00%,0,46620,91000765
5CUtp1hNoFDz7W3yPgphJHw8dwzEKnQBYYXB6oq6pZ83ynzL,"25,000","30,054.11845699298",1,5.00%,0,46515,91000790
5FZS8CjeeysTNtLurLmZKb7EgRmVxwb72Pnes1irVbbgf28p,"25,000","29,439.74459382624",2,5.00%,0,45570,91003476
5E21RjnbVvb5VHaoouuHpMwDx3Y7bmeE1wV5fL44cD7hRK8S,"25,000","28,402.68885383922",1,5.00%,0,43960,91001691
5CkXD22v1L5tgVCzDtu6QPhbJEgCive5A5cRTdNEzHJUcXyx,"25,858.9999999995","28,021.47917414582",1,5.00%,0,43365,91001675
5EXACYH9LDfD8s2ZdDF9MidwtHdCPvPCNubh8T9o3sNwoyvj,"25,858.9999999995","27,889.17549368288",1,5.00%,0,43155,91003485
5CffuSz6PnrKnVHSWEM42qfX47sxLiztj8XxJfkn2CDFM5BM,"25,070.9999999995","27,708.410634052",1,5.00%,0,42875,91004116
5FEt4URsJxiyMtXJwPiti5TFckULdtszLVpcLNU4beoEWV3A,"25,000","27,201.8092300391",1,5.00%,0,42105,91001666
5Cu3tMLK17GUUQ8rCwZkVVyHTfr1CfSSkEE4u5zLAraPm1TR,"25,000","27,109.93111820972",1,5.00%,0,41965,91002582
5GKcXLLub2Cd26dnzfDit99uJ5wZZhtcXuJLWxzxynHhxvfd,"26,092","26,092",0,5.00%,0,40390,91004098
5GLQJ5mD1PbaeJ2KKc2Btn6eodMxVBJqT27WFsaSuMX82G8Y,"25,253","25,253",0,5.00%,0,39095,91002558
5DxrqFfMPP6pUigSkSqKgHtgdwe8gtjGRsBNkW9xs9YfdHv8,"25,043.99769093014","25,043.99769093014",0,5.00%,0,38780,91002564
5EhjXmV3XDaJCUmVM5fZ8uie8rLKZD2U8NNXykLBUjbYcfFT,"25,018.35762818424","25,018.35762818424",0,5.00%,0,38710,91002557
5D8HUhCqhoDJzW5cKCdrswwJJFKBXvqMoWLxXYi3JLHfaEEM,"25,002.9999999995","25,002.9999999995",0,5.00%,0,38710,91001677
5EqqrNtEm7k1rRHxK9mXjGmhTnqw3rqS2bGXXu9R2W6T8yyk,"25,000.000001","25,000.000001",0,5.00%,0,38710,91002574
5ECetJJ2SMZ86AdMWpZhcbND29j5XDCcAyRiidJ3VYcB3fBs,"25,000.000001","25,000.000001",0,5.00%,0,38710,91000775
5GpqmjC3i8Ks4Aok2TazAKCj9zoEJoCgnuA2UXxt6ykwV5rA,"25,000.000001","25,000.000001",0,5.00%,0,38710,91002575
5F4VxZXUhfaYSd49rLRjPJdgucx7PSbmDotpsmuKoNk4icKi,"25,000","25,000",0,5.00%,0,38710,91001664
5H11ZxQQGrc6QNp97s92FkReeSqkwaPZGCPvgTVjMNoJyLoy,"25,000","25,000",0,5.00%,0,38710,91003481
5Ct2UTjd1tTUeuR4LGNk71Vq6taGB9HVA65QPurauH1SxCbr,"25,000","25,000",0,5.00%,0,38710,91000761
5D9eW7s1FFczYuGtnZsJuCyG9uWTFvN7Q51VmKyi3SBVfZTf,"25,000","25,000",0,5.00%,0,38710,91002589
5GP1mwCgfZfJL9KpXg4N5pcEje8TU3Lxv6xZtnoVK9LrxJwi,"25,000","25,000",0,5.00%,0,38710,91001686
5DyhgyBLrKM5mUcePv6AQRyJeKBNpvMB517dTYPBVU5zamJn,"25,000","25,000",0,5.00%,0,38710,91004080
5F6ajakj8xYyg2Tqt7b55e5S7iouoGGypqEy5Y1ycscqdB96,"25,000","25,000",0,5.00%,0,38710,91004077
5Ft9TSaxcGb2zYHAeqLFsCfWMtz7CaRBE4GzbvPNK1ipxScU,"25,000","25,000",0,5.00%,0,38710,91002581
5Fo2xd95nfxE8McPVVJ1T5ZduHtpEaFe8mj1vXLjLNumx4SJ,"25,000","25,000",0,5.00%,0,38710,91003492
5EHhWZ8BqMoKdaNYGbTvCJgEoq59Ve1g1ij92YbqcBRsLL1D,"25,000","25,000",0,5.00%,0,38710,91000764
5H4FbsDqPVqjbo5Mh8aFFfDhXjzCvJpVe7EvVS1LYHyfhPKf,"25,000","25,000",0,5.00%,0,38710,91001671
5GCccwqh1PuXvshDe4bAAJrstZxbHX2u66hK3UAR6hxbFbha,"25,000","25,000",0,5.00%,0,38710,91004113
5GCLDdsjA48uRXnVzSjTMUwBJNJBpfxzt3BbXH7fK1z46fxg,"25,000","25,000",0,5.00%,0,38710,91004078
5FxfS4LqBAC4LxpDJp3UB6nxDZ9hULTzvtDe8Hriwdz3Y8GG,"25,000","25,000",0,5.00%,0,38710,91003482
5DyyaxFRbRhSoTPUakMozkKfs7umRU894ZKEhdkrbVqAG1J1,"25,000","25,000",0,5.00%,0,38710,91002568
5D9k3ZTxyGLcWURE1pPeLvydbZghnvS4jzFSVJQzh49YQXrd,"25,000","25,000",0,5.00%,0,38710,91004076
5CFteh4v9fDMVXKDyBhA3iGvXryzoSB8RTYgCEVQLFkWwgJX,"25,000","25,000",0,5.00%,0,38710,91003455
5ELuPmR4Y6WLSw3y8DcGDKEQTTzRrxw5TFjmDj4axpnFZEEM,"25,000","25,000",0,5.00%,0,38710,91004096
5Ge5AJmh6g2td7RpF8yXa8jzB5Zz28GQmquuTUBSaVZewtnB,"25,000","25,000",0,5.00%,0,38710,91004094
5EvJWUqWMxPH5Db6833QANoQh76NvLLu6ih27yXawvTCe4XM,"25,000","25,000",0,5.00%,0,38710,91000777
5DF6SpA4846ZE3CMJYYQs61ybpV8RXHR4RRe8cZiFgJE5Tb9,"25,000","25,000",0,5.00%,0,38710,91004110
5Ev9uGdBjdukHRNTiVm1B94JsduVLTbqsHN9PzG2WJGZmENS,"25,000","25,000",0,5.00%,0,38710,91004091
5ES27zTAJJ2V7NkZS5FdxiwHXtyGrCg2ZfLMUCNHZehtLcnE,"25,000","25,000",0,5.00%,0,38710,91004106
5FCa1rb7C3djd2vegUZ5bH8RS7jkqQuLXqkxbtmG8Eg3Xsr4,"25,000","25,000",0,5.00%,0,38710,91001679
5Ebqb9czFEk4cEh4NWwbRurn26Y8JDT5fnTSSUaEGnibxcVe,"25,000","25,000",0,5.00%,0,38710,91002586
5DcKT7iesj1h6qww11r4sTKVW9W8mDypJAnqsrsDyRci8WA5,"25,000","25,000",0,5.00%,0,38710,91002587
5Gjy5yh1ZtHFDkqptN2UqyMMqTjPSZSH8nJcz3oTA6Z6Dtmy,"25,000","25,000",0,5.00%,0,38710,91003468
5FTvJh48vCxb6nN6GMWick51BefLxtxSTmx5XMdXX2ueW7pH,"25,000","25,000",0,5.00%,0,38710,91002594
5EptWnbCf3USibHoeKinzxbG9BGDYgDegS32ZhFpiy5Tv23k,"25,000","25,000",0,5.00%,0,38710,91004097
5Ef8JnMbyR3mmQ4Ka3qRYoCMAm6oMQWe2pQqs6ejTgcBydst,"25,000","25,000",0,5.00%,0,38710,91001694
5EUr7MpjzMzQUbAV9ayDokhvGYyTakoadDtJ7zUfa9JmYkoT,"25,000","25,000",0,5.00%,0,38710,91003480
5Hg7AoE3DQbwjbRspgDNEPFotPQTnYZzw6z9eQHgjZ96Ui8g,"25,000","25,000",0,5.00%,0,38710,91002563
5C5JGfEfWjjMb93662YShjjMJpWCYFaVL4XP324seb3gDZyW,"25,000","25,000",0,5.00%,0,38710,91002561
5CFb5971cUWrJ4U7FU4ixjVi4z21eYr49WVenURmp2bjgYzm,"25,000","25,000",0,5.00%,0,38710,91001692
5Hg3o7pFytwPySAqoZqDXBXwG5a8p7mQfmSMBubi4CpGrs7c,"25,000","25,000",0,5.00%,0,38710,91002553
5Dpz6qMBeDpNBR4ySMAekL3Rx2HNi2KTdC4ZFeoftqPKEEe8,"25,000","25,000",0,5.00%,0,38710,91001685
5G6fCsytPQQY4kxzqj8BYXKsPMtaGwMvNe3tkbH6wymQA5EC,"25,000","25,000",0,5.00%,0,38710,91003483
5DcHEjTFJdWU7n7JZpUoGXH83mTQowRPswk5CA1dnHLCFgb5,"25,000","25,000",0,5.00%,0,38710,91003469
5FBhhaMsbF3qJdGqktGQVAmdG2cDQXNTTEw55UUYr5T2rU5L,"25,000","25,000",0,5.00%,0,38710,91001676
5DJpQmZA9274QGAkCYVTuM3yGA8kMsTEMCtYGrzfEn5xLsVJ,"25,000","25,000",0,5.00%,0,38710,91002593
5GCQA6B6AwJ5hEth3ykGH3WuqWzwWyBZzyVXsUzuWmRtxajd,"25,000","25,000",0,5.00%,0,38710,91002566
5C5iGGmep7GvJVrdjgCD9UUbf7PZvq6ggtBTRKs83C2v536P,"25,000","25,000",0,5.00%,0,38710,91001690
5F1PSGv7fbdoTiadndG7E4o4ocDEFjBDKDBQ23pCSVCH3t4W,"25,000","25,000",0,5.00%,0,38710,91003461
5Hgak5fottM7DZRWogdrrWBXc81GdBvzUiEHEoWfxfbXHgsJ,"25,000","25,000",0,5.00%,0,38710,91001652
5Dt6CgiQSCvNMCCpXNoJxVfnenX65f14Wr5X1tJys5o1opDB,"25,000","25,000",0,5.00%,0,38710,91003497
5GGyCUUoeM4PGBphbNhwKg1mWSAtXkfTZyLfeAyWNiWLhR7i,"25,000","25,000",0,5.00%,0,38710,91003459